timestamp,text,hashtags
1576425360,That is crazy thing happening with United not able to grab a win against weak teams. But Mason Greenwood is a true 'saviour' for United \ud83e\udd18\ud83e\udd18\ud83e\udd18Wonderwonderkid#MUFC #MUNEVE,#MUFC
1576425361,"Greenwood came through again.Wan Bissaka did his job well.Daniel James if not careful might end up like Theo Walcott, speed but no brains. #MANEVE #MUFC #ManUtd",#MUFC
1576425361,"More dropped points, not good enough. We needed to win this game especially after beating City and Spurs. Conceding a soft goal and chasing the game. Thankfully Greenwood got the equaliser.. #MUFC",#MUFC
1576425362,Again it end in tears#MUFC,#MUFC
1576425362,2 steps forward 1 step backwards. So disappointing  #MUFC,#MUFC
1576425363,Racism or Unsportsmanlike? The fair play rules might have put Kelechi Iheanacho into problems.READ &amp; Drop your opinion in the comment box &gt;&gt;&gt; https://t.co/SMlkFNbkrH#MUFC #RevolutionNow,#MUFC
1576425364,That's the problem with United always ready for the big games #MUFC,#MUFC
1576425365,Martial does nothing except trying to shoot on goal and fancy stuff.Never puts a shift in. Never tries to set up other players. Time to bench him and start Mason Greenwood.Fucking bullshit.One more reason why we must must sign another striker.#MUFC@ManUtd,#MUFC
1576425367,What the......#MUFC ??????,#MUFC
1576425367,HT: Manchester United 1-1 Everton#MUFC,#MUFC
1576425367,"\""ole is at the wheel\"" #MUFC https://t.co/5hcCYGJ8K3",#MUFC
1576425368,This still stands #MUFC,#MUFC
1576425369,Expected result and performance #MUFC #MANEVE,#MUFC
1576425369,Poor performance from start to finish.. #MUFC,#MUFC
1576425369,"Manager back to his sterile mediocrity, team back to their usual self... You have to be awfully bad to lose points against Everton. The last week was an aberration. #MUFC #MUNEVE",#MUFC
1576425370,It's all time waste for me. As a fan I'm disgruntled. We are not going to sign anybody in January. We will finish between 8th to 12th #MUFC #MUNEVE,#MUFC
1576425370,"Lindeolf, man... Come on. #MUFC",#MUFC
1576425371,Seriously no penalty no win ? Seriously @manutd ? #MUFC,#MUFC
1576425371,Fucking shambles. Why do these cunts only show up for half the season. Joke. #MUFC,#MUFC
1576425372,"Can hurt teams who attack us, via the counter attack but United also need to learn how to beat teams who defend deep. #MUFC",#MUFC
1576425372,Frustrating result and two points dropped. Missed opportunity yet again. #MUFC,#MUFC
1576425372,Typical #MUFC absolute shite! #MUNEVE,#MUFC
1576425372,Inconsistent Manchester United\ud83d\ude2a\ud83d\ude2b #MUFC,#MUFC
1576425375,1-1 FT.So disappointing. Our own worst enemy today. Got to take our chances. Big opportunity to close the gap missed. \ud83c\uddfe\ud83c\uddea#MUFC https://t.co/gMWRA4anb0,#MUFC
1576425376,United won't make top 4 #MUFC,#MUFC
1576425377,"Next matches are gonna be a lot difficult because it's Watford, Newcastle and Burnley. #MUFC",#MUFC
1576425377,@ManUtd @_MasonGreenwood fuck Michael Oliver #MUFC #MANEVE,#MUFC
1576425379,Under Mourinho we would have won that comfortably. #MUFC,#MUFC
1576425380,"@aditya_reds We certainly don't know how to take advantage of other teams defeats. Something we have to learn. That's 3 draws out of the last 5 in premier league. These came against Blades, Villa and Toffees. Strange!! #MUFC",#MUFC
1576425380,Scariest part about @ManUtd right now is that our manager couldn\u2019t be more comfortable. Has absolutely no fear of being sacked. Glad the players like him so much as we finish 8th #MUFC,#MUFC
1576425380,"One step forward, two steps back. Poor from United today. Wan Bissaka different class though \ud83d\udc4f\ud83c\udffb #MUFC",#MUFC
1576425381,No bad words today #MUFC,#MUFC
1576425382,Are we the new Robinhood ? #MUFC,#MUFC
1576425383,"Disappointing results! We seems not to be taking opportunities thrown at us this season. The season is still long, we go again in the efl cup on Wednesday. #MUFC",#MUFC
1576425383,#MUFC has sunk so low to a point where they just try and win games against the top 6 to prove a point rather than doing that while winning against the rest of the teams and fight for the league. Tactically inempt!,#MUFC
1576425383,Why the fuck can't we win against shit teams. Maybe we should start working on breaking down defenses other than just counter attacks. We don't have a single player out there who can create and be a decent playmaker. #MANEVE #MUFC #ManUnited,#MUFC
1576425383,Manchester united has ruined my bet\ud83d\ude29i wont bet again. #MUFC #MUNEVE #oleout,#MUFC
1576425383,"Time to name Greenwood number 1 striker, only natural goalscorer at the club. #MUFC",#MUFC
1576425383,"Hey EPL, Can't #MUFC just play Citeh, Chelsea and Spurs every week?Us mortal fans just can't deal with the sheer incompetence on display when they play anybody else.K Thanks guys!! #MUNEVE https://t.co/ItCEaHgkEF",#MUFC
1576425384,Mata coming in was completely unnecessary. When you know your team relies on counter-attacks#MUFC #MUNEVE,#MUFC
1576425385,Once again a lack lustre performance against lesser team #MUFC,#MUFC
1576425385,I'm a utd fan but I love big Duncan Ferguson #MUFC #EFC,#MUFC
1576425385,That was awful from @ManUtd can\u2019t beat an Ill and injured average Everton team! Still not convinced with Ole. One step forward two steps back. #MUFC,#MUFC
1576425387,"First half chances cost us again , a point is better than nothing. #MUFC",#MUFC
1576425387,FUCK OFFFUCK OFFFUCK OFFFUCK OFFFUCK OFFGO FUCK YOURSELF!!! #GGMU #MUFC@Fred08oficial @Fred08oficial @Fred08oficial,#MUFC
1576425388,WOLLY FUCKING SOLKSJAER OUTCLASSED BY DF Im fucking done with this bastard seriosuly wake up and smell the coffee this guy is managing our club how far have we fallen united are finished #MUFC,#MUFC
1576425389,"The de Gea error cost us the game, but too many players were average\u2014Shaw, Lingard, and Martial to name a few. Rashford had good movement and got shots off, but couldn't hit a barn door. Martial only turns up once every 5 games and Lingard goes AWOL too often.#MUFC #MUNEVE",#MUFC
1576425389,"Match we're expected to win we won't, the ones we're expected to lose or draw we will then win. This team nor go kill person #MUFC",#MUFC
1576425391,Looks like Man U are back to default setting. Draw season about to start. #MUFC,#MUFC
1576425391,FT Manchester United 1-1 Everton #MUFC,#MUFC
1576425391,Dropping points when it needed is what United best at #MUFC #MUNEVE,#MUFC
1576425393,How do you go from beating Manchester City at the Ethihad stadium to picking a point against Everton at the Old Trafford\ud83d\ude23\ud83d\ude2cRoller coaster ride with this club\ud83d\ude33#MUFC,#MUFC
1576425395,Greenwood has to start against every team with a low block. Only pure goalscorer in the team.#MUFC #MUN,#MUFC
1576425396,"Spurs &amp; City..... Then today at home to Everton dropped pts.... United have become experts at this FFS. So pissed.... Only positive point was my boy Greenwood. I want Mason to start more up front now, he can finish. #MUFC",#MUFC
1576425396,Mason Greenwood needs to start #MUFC,#MUFC
1576425397,This is not the players fault. Ole simply aint good enough. #MUFC,#MUFC
1576425397,The performances of Martial &amp; Rashford today further prove the need for additions of quality up the top end of the pitch &amp; u have Utd fans questioning why we\u2019re in for Sancho &amp; Haland. I also don\u2019t have a clue what the point of VAR is if it\u2019s allowing goals like Everton\u2019s\ud83e\udd37\ud83c\udffb\u200d\u2642\ufe0f #MUFC,#MUFC
1576425397,"This game proves with absolutely zero doubt the we desperately need to get in a creative midfielder in January! All of our great chances were created off counter attacks. But never the less, I\u2019m proud of the way our club played and fought today! #MUFC",#MUFC
1576425400,#MUFC just weren\u2019t at it today. They started well. But when Everton started to assert themselves we couldn\u2019t cope. They deserved their and De Gea is at fault for that goal. Just not strong enough. That\u2019s unacceptable. #MUNEVE,#MUFC
1576425400,"Joke of a goal to concede, joke of a performance from all those players bar Fred, Wan Bissaka and Greenwood. \ud83e\udd26\ud83c\udffe\u200d\u2642\ufe0f. Typical to beat City and draw with Everton. \ud83d\ude43#MUFC",#MUFC
1576425400,Some fans don\u2019t want Sancho cause we have James unoo\ud83e\udd23\ud83d\ude2d #MUFC,#MUFC
1576425401,"We have to play one way because of the players we have. We\u2019ve no plan B. Even saying that, Plan A isn\u2019t even fully functioning. So much work to do. Shame our board are wank. #MUFC",#MUFC
1576425402,Rashford sans penalties#MUFC #MUNEVE https://t.co/TL1IlEr8B3,#MUFC
1576425402,"7am departure, 5 hour journey, 200 miles journey to get to here. Good game today, Greenwood is the real deal. The love for this team #MUFC #UTFR \ud83c\uddfe\ud83c\uddea https://t.co/Ea8Jl3bnCA",#MUFC
1576425402,"Why does it take us 70/75 minutes to think fuck it, let's attack? \ud83e\udd14 Should be playing that from minute 1 #ManUtd #MUFC",#MUFC
1576425404,Where are all the #OleIn crowd now? There\u2019s no way you can see us put in two massive performances to get the wins over Spurs and City and then see us put in the performance like today and still thinks he\u2019s the man for the job \ud83e\udd26\ud83c\udffc\u200d\u2642\ufe0f #MUFC #MUNEVE #OleOut,#MUFC
1576425404,Your players didnt wanna try.. Clueless.. No spirit to attack.. WTF is wrong with them????? This is shite clubs ffs..!!!!! Its not the manager.. Its the players.. OMG.. just wanted to piss at them one by one.. Stupid stupid.. #MUFC #MUTV,#MUFC
1576425405,"We can't win anything with these players. Too many unintelligent, leftfooted but talented players in one team.  Mostly too slow at times. Performance level dropped immediately after levelling instead of increasing. It looks likely that this inconsistency will continue. #MUFC",#MUFC
1576425406,Issa draw \ud83e\udd17 delete thise drafts #MUFC,#MUFC
1576425407,Fuck 2 point lost. MU always be  my weekend comedy #MUFC,#MUFC
1576425408,1-1. Disappointing.VAR. Disappointing.#MUFC,#MUFC
1576425408,"#MUFC I would like to say we played shit today !! But we weren't even that good ,Martial ? Rashford ? Not consistent enough either world beaters or shit And it's shit more often that not",#MUFC
1576425411,@reshmikasingh If not for greenwood we could have lost this game #MUFC,#MUFC
1576425411,I said it you can't trust this Manchester United squad when it comes to struggling clubs. Another missed opportunity to close the gap on Chelsea. #MUFC,#MUFC
1576425411,Typical Man United (Is that the United Way \ud83e\udd14)... Beat Spurs and City in 3 DAYS and go on to draw with Everton! Poor poor results that! But so happy for my boy Mason Greenwood... Martial FC is dead... Greenwood FC\ud83d\udd25 #MUFC #MUNEVE,#MUFC
1576425412,"@ManUtd @_MasonGreenwood There's a lot of pace upfront but no one's making a room, no killer pass, nothing. Thanks to Mason for saving us a point. #MUFC",#MUFC
1576425412,The number of points between #MUFC &amp; Leicester City is embarrassing. #MUNEVE,#MUFC
1576425413,"OGS tactics work against the teams who control the ball but not against others. Although I will say today was better than the normal drab against lower teams, not sure how we will figure it out. But hopefully we do! #MUFC #MUNEVE",#MUFC
1576425414,"Maybe #MUFC should stick a mannequin of Mourinho or Guardiola in the opposition dugout: dominant against the leading teams, but too often disappointing against everyone else.",#MUFC
1576425414,Disappointed with #MUFC \ud83d\ude14,#MUFC
1576425415,FT: United 1-1 Everton: A Victor Lindelof own goal &amp; a Greenwood goal for United means it finishes all square at full time. United had chances to score more but didn't take the chances that they had. United stay in 6th place after Spurs beat Wolves &amp; go above us. #MUFC #HJ,#MUFC
1576425416,#MUFC I will no longer be watching Man U games!!,#MUFC
1576425416,Ehh Robinhood trend continues for #MUFC,#MUFC
1576425416,Mason Greenwood has that Robin swag... Good finisher.. Looking forward to see how he develops..#MUFC #MUNEVE,#MUFC
1576425417,FULL TIME: Manchester United 1-1 Everton. Wolves 1-2 Tottenham. Mason Greenwood's strike earns #MUFC a draw. Jan Vertonghen's late header gives #Spurs all three points.,#MUFC
1576425417,"5 teams ahead of United in the league and we\u2019ve beaten 4 and drawn with the other. Of the teams in the bottom 7, we\u2019ve only beaten one of them.... anyone care to explain? \ud83e\udd37\ud83c\udffc\u200d\u2642\ufe0f #MUFC",#MUFC
1576425418,Greenwood stock rises more. A poor performance from United though. United didn't match Everton desire. They won the majority of the 50/50's. Disappointing. #MUFC,#MUFC
1576425418,East West home is always da fuckin best... we\u2019re back to 6th #MUFC #MUNEVE,#MUFC
1576425418,\u201cIt was just to waste time\u201d mate you\u2019ve absolutely humiliated a young player on a massive stage. You can\u2019t just act like that\u2019s okay. Why would you do that if it\u2019s not personal? #MUFC #EFC,#MUFC
1576425417,"Far better against a team that had no interest in playing today. Performance was there, the result wasn\u2019t. Hopefully one or two reinforcements in January can help boost our season #MUFC",#MUFC
1576425419,"Wan-Bissaka, Fred and Greenwood very decent. The others... predictably average. #MUFC",#MUFC
1576425420,That cross in from Rashford proves further the lack of a striker. When that ball came to Mata there was no one near their centre backs and then when Rashford got it there was only 1. That 2 points dropped. #MUFC,#MUFC
1576425421,"FT: #MUFC 1-1 EvertonAnother missed chance &amp; more points dropped at home against a side in the bottom half of table. Mason is such an incredible talent but we just didn\u2019t have enough creativity on the whole, surely we need to bring someone in in January... https://t.co/vj9xWTb15a",#MUFC
1576425422,Full Time#MUFC 1-1 EvertonMason Greenwood's second half equaliser means the game ends in a draw\ud83e\udd14 What did you think United fans?\ud83d\udcf2 Text 81333 start msg 'Manc'\ud83d\udcde 0800 218 2255\ud83d\udcfb Reaction on 95.1FM#MUNEVE https://t.co/sWNq08RDZW,#MUFC
1576425424,"We need a gud, proper striker... Hope we get one... Any one will b better then wat we have!! #MUFC",#MUFC
1576425425,Well considering the awful missed call by var that gave Toffees their only goal we're lucky to have Mason Greenwood to at least equalize for us to get us a point and the draw. On to the next match. \ud83e\udd18\ud83d\ude08\ud83d\udd34#MUFC #GGMU https://t.co/469HjPbsxd,#MUFC
1576425425,"Couldn\u2019t do anything right in that game... not in the right positions at time, passing was poor, shots went in row z... players on \u00a3120,000 a week and can\u2019t take a corner, Other than @_MasonGreenwood coming on and scoring another good goal we were poor #MUFC #MUNEVE",#MUFC
1576425427,That\u2019s so typical we fall against any team that defend and play counter all the 90min cause we don\u2019t have any power or creativity to break their lines we only wins against big teams cause they play with open defense for our counters #MUFC #ManUtd #ManUnited #Manchester,#MUFC
1576425427,Fair match #MUFC,#MUFC
1576425428,"1 step forward, 2 steps backward #MUFC",#MUFC
1576425428,Deluded if you didn\u2019t see this coming a mile away. Inconsistent as fuck. #MUFC #MUNEVE,#MUFC
1576425429,"*yawn Mediocre #MUFC. Expected, after 2 decent performance against Top 6 clubs. #MUNEVE",#MUFC
1576425429,#MUFC has sunk so low to a point where they just try and win games against the top 6 to prove a point rather than doing that while winning against the rest of the teams and fight for the league. Tactically inept!,#MUFC
1576425429,Hot and Cold #MUFC . Great attempt though #MUNEVE https://t.co/ajDERiYqak,#MUFC
1576425430,We might as well rename ourselves as \u201cTwo steps forward two steps back\u201d Bloody typical every week against the small teams. We concede rubbish goals and can\u2019t break them down! But we go again on Wednesday! Chance to get to a domestic cup semi final! #MUFC,#MUFC
1576425431,"Magic tactics: Greenwood receives instructions from Ole, scores 15 minutes later \u26a1\ufe0f #MUFC #MUNEVE https://t.co/IlK15FphwX",#MUFC
1576425432,Disappointed but not surprised. #MUFC,#MUFC
1576425433,"Every season they will have a youngster who everyone would tip as the next Messi, Ronaldo, etc etc  but come the following season  \ud83d\ude06\ud83d\ude06\ud83d\ude06 #MUFC",#MUFC
1576425433,"Imagine bringing on a old, slow past it Juan mata when u need to score and win. Offers nothing anymore #MUFC",#MUFC
1576425433,the inconsistency of @ManUtd #MUFC these are games we should be winning,#MUFC
1576425434,An Academy Kid Mason Greenwood scoring for Manchester United and helping to avoid the defeat on this occasion where Manchester United academy players are part of first team squad for 4000th time. Iconic.#MUFC #MUNEVE,#MUFC
1576425437,How can you expect to break a deep block without a creative midfielder we desperately need POGBA back......#MUFC #MUNEVE,#MUFC
1576425439,Greenwood is the real deal guess he should be starting. #MUFC  #MUNEVE,#MUFC
1576425439,Just let them go in January. Enough of this charity: MataJonesMaticLingard Pereira That's enough space for five good players...#MUFC #MUNEVE #OleOut,#MUFC
1576425439,"Oh fuck off with your \u2018Ole In or Ole Out\u2019, it\u2019s actually boring as fuck now, like a broken record \ud83e\udd26\ud83c\udffc\u200d\u2642\ufe0f #MUFC",#MUFC
1576425439,When all odds favour #MUFC they bottle the opportunity. \ud83d\ude20 #MUNEVE,#MUFC
1576425439,@Box2BoxBola Mood fans #MUFC https://t.co/eDKrKljMBX,#MUFC
1576425441,Such a disappointing performance and result. Team looks so stale against well organised defenses. No creativity except on the break. #MUFC,#MUFC
1576425442,FT: Manchester United 1-1 Everton#MUFC,#MUFC
1576425442,Incase you missed it \ud83e\udd23 #MUFC https://t.co/Nwv4E2rRvD,#MUFC
1576425442,"I know lingard had personal problems, but if you think that\u2019s the reason he\u2019s been shite for months, then you have more problems #MUFC #MNUEVE #Lingard",#MUFC
1576425442,Most G+A PL Clubs 2019/201\ufe0f\u20e3\ud83d\udc3a Jimenez = 15G+8A2\ufe0f\u20e3\ud83e\udd8a Vardy = 16G+3A3\ufe0f\u20e3\ud83d\udd34 Mane = 13G+6A4\ufe0f\u20e3\ud83d\udd34 Salah = 13G+6A5\ufe0f\u20e3\ud83d\udd35 Sterling = 14G+4A6\ufe0f\u20e3\u26aa Son = 10G+8A7\ufe0f\u20e3\u26aa Kane = 15G+2A8\ufe0f\u20e3\ud83d\udc79 Rashford = 13G+4A9\ufe0f\u20e3\ud83d\udd35 Abraham = 13G+4A\ud83d\udd1f\ud83d\udd35 Aguero = 13G+2A#CFC #LCFC #LFC #MCFC #MUFC #THFC #WWFC #WOLTOT,#MUFC
1576425443,Manchester United this season. #MUFC #MUNEVE https://t.co/QFenKHyz3h,#MUFC
1576425447,"@manuntdchat Only deluded OleCult followers who live in 1989 believe that the ones that know are called plastics for saying as is, Ole is out of his depth playing ceding possession counter attacking shit football #Oleout #MUFC",#MUFC
1576425447,"Really need to learn to break teams down by getting the ball forward quickly at every opportunity, can\u2019t keep giving them time to park the bus #MUFC",#MUFC
1576425449,Duncan Ferguson is a racist ....#MUFC #MNUEVE,#MUFC
1576425449,"Takes a teenager to save us today - Greenwood is our best finisher. Martial missing, Rashford nullified, Lingard anonymous. These players need to step up in these games. #MUFC",#MUFC
1576425451,So predictable when it comes to #MUFC,#MUFC
1576425451,That was so frustrating. #MUFC,#MUFC
1576425451,Well that\u2019ll put a damper on your day #MUFC,#MUFC
1576425451,"That game just shows why we need Haaland, Martial for me is not an elite striker, Rashford Haaland Greenwood for me, Martial James their back up #MUFC",#MUFC
1576425452,Am tired wallahi...... #MUFC One step forward two steps backward. #MUNEVE,#MUFC
1576425452,CLASSIC MANCHESTER UNITED \ud83e\udd26\ud83c\udffb\u200d\u2642\ufe0f #MUFC,#MUFC
1576425453,Well that was 94min of my life wasted #MUFC,#MUFC
1576425454,"@UnitedStandMUFC 2 dropped, referee let them away with murder with time wasting #MUFC",#MUFC
1576425455,Man Utd would be comfortably in the top 4 only for some terrible #var decisions this season.#MANEVE #MUFC #ManUtd,#MUFC
1576425456,Lingard can no longer bench Greenwood simple as that #MUFC #MUNEVE,#MUFC
1576425456,You want to sign H\u00e5land? Sure. But sign him to do what? Score chances that aren\u2019t created. We need midfielders - they must be our FIRST proiority. #MUFC #MUNEVE,#MUFC
1576425456,It comes back to the same problem we've had since the latter days of Fergie's reign. The middle of the park just isn't good enough. #MUFC,#MUFC
1576425458,Not a great result but could have been worse. Mason Greenwood is a proper prospect. #MUFC,#MUFC
1576425459,"Should drop Martial for Greenwood. Good Martial is world class otherwise when Le Sulk kicks in, it's all pretty pointless. #MUFC",#MUFC
1576425459,Typical by United to draw against fu**ing Everton after winning against Spurs and City. Just typical.So sick of this crap #MUFC,#MUFC
1576425459,Who is better saka or greenwood #AFC #MUFC,#MUFC
1576425459,Trump doesn't need that wall. Just get him a Wan-bisaka #MUFC #MANEVE,#MUFC
1576425460,"Think the lads were feeling themselves a little bit too much after the derby. Inconsistent is what the theme has been this season, might continue. January should be interesting... #MUFC",#MUFC
1576425460,Rashford is forced to shoot from that distance because there are no movements in the box!!!Bunch of useless players who don't know when to be aggressive for goal.\ud83d\ude20\ud83d\ude20\ud83d\ude20#MUFC #MUNEVE,#MUFC
1576425461,finally decoded the Greenwood tactics #MUFC #MUNEVE https://t.co/UqgLK6xWMO,#MUFC
1576425462,What a bitch!! When he can\u2019t find a reason to jerk \u201cole in\u201d he blocks. #MUFC https://t.co/zqXZMF6Gbo,#MUFC
1576425462,"And now we slip down to sixth, while the Spurs lead us. I am crying! #MUFC #MUNEVE",#MUFC
1576425463,#MUFC this yr away win @ reigning domestic treble holders/2 time def champions rout top 4 side Chelsea beat 2nd place Leicesteronly 1s not to lose to Liverpoolalso1st ever home loss to Palacedraw w/ 18th 16th 15th place sides loss to 17th 14th place#PIckaLane #EVEMUN,#MUFC
1576425463,"It\u2019s always one step forward, three steps back with this team. It\u2019s so f*cking frustrating.#MUFC #MUNEVE https://t.co/6cUY1FGADs",#MUFC
1576425463,It was the players today. Not the manager. That was our strongest team.. We have defo got a mentality problem #MUFC #MUNEVE,#MUFC
1576425467,Eventually there was two goals scored and both by @ManUtd. God loves a cheerful giver \ud83e\udd23\ud83e\udd23\ud83e\udd23\ud83e\udd23. #MUFC #MUNEVE. Top four still doable tho.,#MUFC
1576425468,Rashford today when his team needed him the most........#MANEVE #MUFC https://t.co/nxje1vDvmR,#MUFC
1576425471,WE NEED JAMES MADDISON!!!!!!!BRING IN MADDISON!!!!!#MUFC#MUNEVE https://t.co/1xr76mf8Sj,#MUFC
1576425471,Never seen a manager ever being interviewed straight after  a match #Sky sports  #MUFC,#MUFC
1576425471,Sancho is an essential. But we\u2019re not gonna get him if we\u2019re playing like this. James is good but doesn\u2019t work against low block teams. Martial and Rashford were both awful too #MUFC #MUNEVE,#MUFC
1576425472,"I have seen this game numerous times this season. If we score an early goal,we win. If not,other teams grows into game and scores. We become desperate and become more susceptible to counters. Since matchday 1,u can say almost every game,how its gonna play out #MUFC",#MUFC
1576425472,United shit again! Got saved by a teenager AGAIN..OGS tactics are appalling #MUFC,#MUFC
1576425472,Back to normal setting I guess \ud83e\udd23\ud83e\udd23#MUFC,#MUFC
1576425472,"A solid 2 points off top 4 we could have been, with spurs &amp; chelsea playing next. But why take advantage of that eh United? \ud83e\udd2c #MUFC",#MUFC
1576425473,Wonder which @ManUtd player will be the first to say - not the result we wanted but we will learn from this &amp; go again #MUFC,#MUFC
1576425474,Rashford \ud83e\udd1d GreenwoodSaving points for Man United \ud83d\udc40#MUFC #EFC #MNUEVE https://t.co/vsQDFgtSn1,#MUFC
1576425474,Needed to win today #MUFC,#MUFC
1576425475,It's so frustrating to see #MUFC play sides who sit back. Clearly doesn't have the personel to deal with it. It always take a piece of brilliance from someone (Greenwood today). Unlucky own goal and it's a draw.,#MUFC
1576425476,AHH back to the the #MUFC we know and...err...love but get incredibly irritated by when playing teams we 'should' to beat. #BetterAsAnUnderdog,#MUFC
1576425476,"EVERY FAKE FAN SAYING #oleout MUST JUST LEAVE AT THIS POINT. WE LOSE SOME, WE WIN SOME. THAT IS NOT GONNA CHANGE. SO PLEASE STFU AND LEAVE MY CLUB. #MUFC #MUNEVE",#MUFC
1576425478,"FT 1-1 Shit performance that was, back to square one again. Good goal from Greenwood. Evertons goal was lucky should of been a foul clearly. Massive 2 points dropped, why can't we finish these teams off its so annoying to watch #MUFC #MUNEVE",#MUFC
1576425479,#MUFC drop 2 points &amp; miss the chance to close in on 4th https://t.co/r74C5meUvi,#MUFC
1576425481,Greenwood\u2019s finishing is top drawer. More often than not wrong-foots the keeper with his body shape... \ud83d\udc4f\ud83c\udffb #MUFC,#MUFC
1576425484,Anthony Martial is fucking overrated. Lazy brat. #MUFC,#MUFC
1576425485,"It\u2019s about time Mason Greenwood was playing from the start isn\u2019t it? Put him in for gods sake, Ole. #MUFC #MUNEVE",#MUFC
1576425485,It's about time Greenwood starts some matches ahead of Martial. #MUFC,#MUFC
1576425485,@UnitedStandMUFC 2 lost... Crying out for a midfielder... Again and still waiting.. Had some great positions but we panic or go for glory... 6 wins all season..... And it's nearly Xmas #MUFC,#MUFC
