timestamp,text,hashtags
1576421555,Why are so wack against lesser teams #MUFC,#MUFC
1576421559,Doesn\u2019t Michael Oliver just have one of those faces you just want to smack? Prick. #MUFC,#MUFC
1576421560,So what does united do in a game that will take them 2 points of top 4?They score an own goal.\ud83d\ude11#EPL #MUFC,#MUFC
1576421564,Lindelof has a bit of the chris smallings about him on the ball for me robotic an slow like the balls always stuck in his feet Tuanzebe should be starting more games &amp; luke shaw is just luke shaw #MUFC,#MUFC
1576421565,"1st half thoughts for #MUFC #MUNEVE :- Luke Shaw poor- Elbows allowed now?!- Lingard quiet- We remain in a position where if we play against a defensive line-up, they keep catching us on the break.Going to have to play with more tempo and guile in the 2nd half to win this.",#MUFC
1576421567,Shaw having a mare. United piss poor. \ud83e\udd37\ud83c\udffb\u200d\u2642\ufe0f #MUFC,#MUFC
1576421568,@ManUtd Without any delay Ole should bring in @_MasonGreenwood &amp; B Williams for @JesseLingard &amp; @LukeShaw23 #MUFC #MUNEVE,#MUFC
1576421569,We might still go on to win the game but the carry on following wins against City and Spurs was ridiculous. Both were good results but were against teams who were way more open and prone to being countered which is our strength. Everton et al. Is where we drop points #MUFC,#MUFC
1576421570,Luke Shaws done. Not fit or lacking in confidence he's shite. Offers fuck all. Stands on the ball an looks to pass backwards/sideways. Let Williams play make mistakes an learn better than wasting time with that lump! #MUFC,#MUFC
1576421571,Calvert Lewin just making everything hard for Lindelof and Maguire isn't he. I'd wish AWB &amp; Shaw would do some more overlapping dummy runs. Both Rashford and James are getting doubled up on. Martial is slow to react to everything aswell. #MUFC,#MUFC
1576421575,What did i say about lindshit ? Please respect me ! #MUFC,#MUFC
1576421576,"\""Panic station whenever Rashford get's the ball, he is so dangerous\"". It Baffles me how biased English commentators are. If it were Auba, Mane, Salah, or Aguero they have nothing good to say. If its Rashford, Kane or Vardy they are out of this world. #EPL #MUFC #MUNEVE",#MUFC
1576421577,Come on to fuck united why can\u2019t we take control or just play like we all know we can if it\u2019s below top six. How many times are we gonna show glimpses of our potential then take our foot off the pedal. The season is a marathon not a sprint consistency is key #MUFC,#MUFC
1576421580,v3.1.0 Update Celebration Campaign is underway!Get 1 free Manchester United player of your choice now! #pescm #MUFC https://t.co/ArdImRytwl,#MUFC
1576421582,"#MUFC haven't been in control of the game. We are not creating chances and are simply trying to squeeze through Everton's defence. We need to stop and think. Push forward as a team and control the game. We got this boys, come on! #MUNEVE #GGMU#FPL",#MUFC
1576421582,"Shaw had very bad decisions defensively. Couple of balls give them back to the edge of the box, including one before the goal. Not sure why he is doing that, it is basic stuff, you learn u U8 not to do that. #MUFC",#MUFC
1576421584,@MrStephenHowson @MustafaTweeets Come on United! @ManUtd #MUFC,#MUFC
1576421585,Poor half to be honest. Okay yes it was a foul on De Gea but we shouldn\u2019t need something like that to kick us up the arse. Big half upcoming #MUFC,#MUFC
1576421586,First half thoughts:\u25ab\ufe0fWe can\u2019t create chances because we can\u2019t play the ball through the thirds from defence to attack which results in us going long and losing the ball\u25ab\ufe0fClear foul on De Gea but we\u2019re not Liverpool so goal stands\u25ab\ufe0f Luke Shaw and DJ have been woeful #MUFC,#MUFC
1576421589,Tuanzebe &gt; Lindelof | Williams  &gt; Shaw #MUFC,#MUFC
1576421589,Poor 45. Normal service has returned? #MUFC,#MUFC
1576421594,Ole has to be ruthless now.. have to bench Shaw and Lindelof at halftime.. If not show angry Ole now then when ??Has to stop accepting mediocrity #MUFC,#MUFC
1576421595,I detest those many sideways passes we play in OUR OWN HALF . Mahn move the ball forward fgs like what the hell are these guys doing? Jesus we are disgrace #MUFC,#MUFC
1576421596,Lingard has been shit so far. Whatever Rashford is doing he needs to improve on it wtf was that??? #MUFC #MUNEVE,#MUFC
1576421596,Yes DDG should/could\u2019ve been more \u2018dominating\u2019 in the area but not so much you can do if an arm is all over your face and being held and blocked. #MUFC,#MUFC
1576421597,"Regardless of sentiments, Lingard needs to be taken off. He clearly need time off the pitch for a while #MUFC",#MUFC
1576421597,Incredibly frustrating. Looked great first 25 minutes and then just stopped. You could feel their goal coming at that point #MUFC,#MUFC
1576421600,Lingard out Greenwood in  please \ud83d\ude4f\ud83d\ude4f\ud83d\ude4fSeriously Lindelof needs to get his act right \ud83d\ude21\ud83d\ude21\ud83d\ude21 #MUFC #MUNEVE,#MUFC
1576421603,"@vlindelof having one of his slow to react, sleepy days. #MUFC",#MUFC
1576421604,"HT #MUFC 0 - 1 EvertonUnited dominated the first half and should likely be 3 - 0 up at the break. We weren't clinical in taking our chances, though. De Gea may have been fouled in the lead up to the Lindel\u00f6f OG, but has to be more authoritative in his box.#MUNEVE #EPL",#MUFC
1576421605,"Between Harry and Shaw, our attacks end before they even start!!!! Trash!  #MUFC",#MUFC
1576421605,Very average first half performance. Quiet from James and Martial. Need  a much improved 2nd half to get anything out of this game. #MUFCPs. I reckon if Allison had been the keeper then VAR would have given the foul!,#MUFC
1576421608,Lack of creative from #MUFC in the first half. That's why players like Eriksen/Maddison are the must in the winter/summer TW. Hope this 0-1 will push the players for the better performance in the second half. The win is a must today. #GGMU #MUNEVE,#MUFC
1576421609,World Record Alert: Abid Ali becomes the first batsman in the HISTORY OF CRICKET to score a century on debut in both ODIs and Tests. #cricket #PAKvSL #AUSvsNZ #INDvWI #Kashmir #KashmirStillUnderCurfew #KashmirBleeds #Kashmiris #KashmirWantsFreedom #MerePaasTumHo #MUFC #NBC,#MUFC
1576421610,@maxmasei @ManUtd Is it true about this Robbin hood shit robbing the rich to feed the poor?? No @ManUtd u got to do something we can't robe @SpursOfficial and @ManCity just to feed @Everton Nooooooo!!#MUFC #mulive #MUAcademy #MUNEVE I rebuke this spirit in Red devil's name!!!,#MUFC
1576421613,Bloody shambles. Debatable goal but we need to play better. #MUFC #UTID #MUNEVE #MUFC_FAMILY,#MUFC
1576421613,Duncan Ferguson has been up and down the touchline like a mad man trying to get a result in this gameAll Ole has done is sat down on his seat like he is watching the game back home in Norway Only got up when we went a goal down and looked clueless#MUFC #OleOut,#MUFC
1576421614,"Man Utd 0 - 1 Eve we were poor and Everton deserve the lead ,we started of well but we let Eve play and an own goal is our downfall, we have bounce back, play attacking football and win this game , go United.#MUFC",#MUFC
1576421615,Like Shaw defending one-on-ones#MUFC #MUNEVE https://t.co/ovJLRJqYaG,#MUFC
1576421616,"Lingard X Maguire first half highlights| Raps, goals, clearences| The next Messi and Suarez? #MUFC #MUNEVE #Everton #EFC #lingard https://t.co/GbfObSupNe",#MUFC
1576421616,Like Shaw isn\u2019t a Man United player. Wouldn\u2019t even start for Everton. #MUFC,#MUFC
1576421616,Tell @ManUtd players to play ball in the midfield!Tell @ManUtd players to play ball in the midfield!Tell @ManUtd players to play ball in the midfield!We are better than these guys ..someone should just hold the ball for 10 secs only in d midfield..#MUFC #MUNEVE,#MUFC
1576421617,Ole needs to be ruthless at this half time talk because that first half was garbage missing any chance that was given......This is Ole time now to show how to make a comeback #MUFC,#MUFC
1576421617,"I asked Ole: did you tell the boys to express themselves before kick-offHe said: leave me alone, Ed #MUFC #MUNEVE",#MUFC
1576421625,"Anywhere else in the pitch and that's a foul, should have been a free kick to United. Can't put your arm across another's players face #MUFC #MUNEVE",#MUFC
1576421632,"A static pube on someone\u2019s left testicle is hanging offside - VAR, let\u2019s debate this for 15 minutes. But this? Immediately wave it on \ud83e\udd23 The VAR farce continues @ManUtd #MUFC @premierleague",#MUFC
1576421637,@DanielJHerman Come with me to St Petersburg! \ud83d\ude09I think these extreme views left &amp; right are in the minority so I\u2019d just watch the 2nd half &amp; hope we can turn this game around \u26bd\ufe0f#MUFC,#MUFC
1576421637,"And don't get me started on that soft ass Lindelof! Son you afraid of the ball?? \ud83d\ude02\ud83d\ude02. Man just watches it hit him then tries to jump out of the way, then watches the goal. Pathetic \ud83d\ude44 #MUFC",#MUFC
1576421638,"Just like to say this, if H\u00e5land does join us I think Martial should be the one who comes out for him #MUFC",#MUFC
1576421639,With #MUFC that was a slow build-up. They need to be a little bit quicker and open Everton up. Play  Lingard in so he can turn and pass to the likes of Martial and Rashford. That's the key for the Reds. It's just too slow at the minute. \ud83d\udd34\u26aa\u26ab,#MUFC
1576421642,Players ganged upon De Gea for that goal. Where is the protection? #MUFC,#MUFC
1576421643,"James left, Rashford and Martial interchanging and Greenwood on the right, let's go #MUFC  #MUNEVE",#MUFC
1576421649,"The first half for us was just to show off that we can score, except that we didn't care enough to get the goals #MUFC",#MUFC
1576421651,"VAR is a utter joke, no consistency at all #MUFC #MUNEVE @premierleague",#MUFC
1576421651,on that note united need midfield maestro to break down teams @ManUtd  #MUFC,#MUFC
1576421652,"Luke Shaw should probably sit out the second half, he's been a liability in this game so far #MUFC #MUNEVE",#MUFC
1576421655,Luke Shaw earns 200k pw. #MUFC,#MUFC
1576421656,Lingard has been shit so far #MUFC #MUNEVE,#MUFC
1576421659,Halftime: Both Wolves and #MUFC are 0-1 behind after the break respectively.#WOLTOT #MUNEVE,#MUFC
1576421665,Anybody can get up for City and Mourinho. Back to reality \ud83e\udd37\ud83c\udffb\u200d\u2642\ufe0f #MUFC,#MUFC
1576421665,"While playing against those teams who rely more on long balls, headers, corners, free kicks etc. #MUFC should pick team differently - i.e. no #Lindel\u00f6f in those cases! #MUNEVE",#MUFC
1576421665,"I need someone to tell me what SHAW as been offering @ManUtd in the last four years that is so special, that he continue to be the club first choice left back all this years.... Let not talk about LINGARD\ud83d\ude0f #MUFC",#MUFC
1576421665,"Making Everton look good started well again to deep and passive Cost us a goal .. DDG should have had the cross , also it was a foul VAR useless as a river boat with no water as always ... heres to the 2nd half #MUFC",#MUFC
1576421666,"If that wasn't a foul on @D_DeGea , I probably can't recognise one. #MUFC #MUNEVE",#MUFC
1576421666,HT : #MUFC 0-1 EvertonCome on united!!!,#MUFC
1576421666,United can beat the big teams but we can\u2019t play well against any teams who let us have the ball #MUFC,#MUFC
1576421668,"If De Gea doesn't shit his pants he clears it, highest paid keeper on the planet mind #MUFC #GlazersOut #WoodwardOut",#MUFC
1576421672,Can't wait for Greenwood to come around 82nd minute and do fuck all. #MUFC #MUNEVE,#MUFC
1576421674,Martial you need to do more in coming half . Don\u2019t be stupid \ud83d\ude21\ud83d\ude21\ud83d\ude21\ud83d\ude21 #MUFC,#MUFC
1576421675,Its been the same old story with Utd 1 step forward 2 steps back #MUFC,#MUFC
1576421675,Basically Ole Out...win one...win another...play good in both games...fans are gassed...Ole stays longer...play rubbish next game...and probably end up losing...pissed fans...Ole Out - circle of Man United #MUFC #MUNEVE \ud83e\udd2f,#MUFC
1576421675,Fuck VAR. proper bullshit in the PL #EPL #MUFC #MUNEVE,#MUFC
1576421675,That Lingard miss in the first minute was clearly a bad omen. #MUFC  #MUNEVE,#MUFC
1576421678,Souness talks so much shit if that bin dippers goalkeeper he would say it's a foul #MUFC,#MUFC
1576421682,Never a foul on Dea Gea for me. He comes out weak and with no aggression. Practically comes out with his back turned which is why he gets shrugged so easily. Looked like the De Gea of old#MUFC,#MUFC
1576421684,"This is why I keep saying signing sancho &amp; h\u00e5land what make the difference Vs 'small' teams, look at lingard he is not creative apart from pressurizing the opponents yet he is our best no10 at the moment, Shaw couldn't make important runs to support attacks. #MUFC #MUNEVE https://t.co/IczDsY3qGb",#MUFC
1576421686,@FourFourJordan He goes forward a lot and offers help in the offense and he\u2019s an asset defensively also. That\u2019s a recipe to get benched. He needs to be useless in attack and a liability in defense of he wants to seal a place in the Starting XI #MUFC #OleOut,#MUFC
1576421686,Ole please take off Lingard and bring on Greenwood. Lingard is ineffective. As a defender Lindalof should be alert at all times. #MUFC,#MUFC
1576421690,"@UnitedStandMUFC (flip flops ) meaning = fans like saeed, only a fan when we win #MUFC \ud83e\udd14",#MUFC
1576421692,stupid referee stating that was normal contact. hehe thats hilarious and damn VAR not doing the job properly. #MUFC,#MUFC
1576421693,Shaw and Lindelof were wrong choice up against physical players. Williams and Axel should be on now #MUFC,#MUFC
1576421697,The sixth time this season and none of them we've been able to win.... Aarrrggghh!!! #MUFC #MUNEVE #PL #WalkWithSagini,#MUFC
1576421697,Michael oliver is the worst ref I've ever seen yano and I've thought this for a while. Tom Davies has literally been taking players out left right and centre and all that Calvert lewin does is swing his fucking arms around and elbows people #MUFC,#MUFC
1576421698,Manchester United fullsquad photo 2019-2020 season #MUFC #MUNEVE   https://t.co/UW0scdatVm,#MUFC
1576421699,"Can we make a come back United way? I certainly think we can, but we need to change our game a little and come back with different attitude. Probably we should change a game plan as well a little bit. #MUFC",#MUFC
1576421700,Need to buy an attacking midfielder and stricker in January.Lingard is Cat Malogan.#MUFC,#MUFC
1576421700,Swear down I just agreed with Souness\ud83e\udd2f #MUFC #MUNEVE,#MUFC
1576421704,"A decent 10 minutes we played  .. Then the inner Spongebob came out of our players   .... Wrong passes, stupid uncounted moves  and the own goal  \ud83d\ude11  Man up now and play like you should .. #MUFC #MUFC",#MUFC
1576421704,That was a very poor half from @ManUtd. Let's hope the boys can move the ball quicker in the second half. These are the teams we need to beat with quick passing and movement. #MUFC #MUNEVE,#MUFC
1576421705,Arms allowed in the face now. Think I missed the rule change #MUFC,#MUFC
1576421706,My dog has more creativity than Lingard. Screaming out for a world class number 10 #MUFC,#MUFC
1576421707,Graeme Souness as idiot as ever listen to... a foul is a foul and should be awareded as a freekick! Finish!#VAR#SkySports #MUFC,#MUFC
1576421710,"Back to reality - can play well against big teams when playing on counter attack, but when expected to control the game and win they shite the kacks ... How was the goal not overturned though? Don\u2019t think United have got a VAR decision this season \ud83e\udd37\ud83c\udffb\u200d\u2642\ufe0f #MUFC #Brutal",#MUFC
1576421710,I think we were having decent game for like 25 mins then everything  went wrong! De gea need to be stronger! Don't  blame lindelof for that goal! Come on lads #MUFC #MUNEVE,#MUFC
1576421711,Team clearly need hair dryer treatment in half time team talk. Most of them are walking dead #MUFC,#MUFC
1576421714,"Old Trafford belongs to Fergusen, i know. we are back. \ud83d\ude02\ud83d\ude2d so, bring back Smalling or buy a f**kin new CD please ffs!!! #MUFC",#MUFC
1576421716,Graeme Souness: \u201cIt\u2019s obviously a foul but the goalkeeper has to have a look at himself. But there\u2019s a real argument for the goal to be ruled out.\u201d #MUFC,#MUFC
1576421718,"@utdxtra Souness: \"" United are losing because of Paul, he should've been there with them now\""#DB #MUFC",#MUFC
1576421718,Luke Shaw needs to take over our social media accounts and fuck off outta this team #MUFC,#MUFC
1576421719,Poor half by United.. VAR is fucked though \ud83d\ude33 how is an arm across any players face \u201cnormal contact\u201d \ud83d\ude44 #MUFC,#MUFC
1576421720,Time to bring on Mason for James to do something creative from the right. Simply attacking down the left isn't enough. #MUFC #MUNEVE,#MUFC
1576421724,"HT #PremierLeague #MUFC 0 (0.94 xG)#EFC 1 (0.46 xG)United unfortunate to be behind here. Lingard missed the games best chance after only 16 seconds (60%), and neither team have created anything of note since #MUNEVE https://t.co/TfrQr5zDaB",#MUFC
1576421725,"Graeme Souness actually backing sticking up for a united player, more shocking than the VAR decision #MUFC",#MUFC
1576421727,\u201cCalvert-Lewin\u2019s got his hand in his face... How is that normal contact?\u201d Scouse that Graeme Souness even calling it correctly. Michael #Oliver you\u2019re a fucking cheat. #MUFC #ManUtd #MUNEVE,#MUFC
1576421728,"De Gea\u2019s face being covered being classed as \u2018normal contact\u2019 lol, if that\u2019s against Alison that would be a foul and probably a booking. #MUFC",#MUFC
1576421728,Can\u2019t believe people are calling for a foul on De Gew for the goal. Keepers usually get way too much protection. He\u2019s got to be stronger there. #MUFC #MUNEVE,#MUFC
1576421729,This is exactly why I think RW is a much bigger problem area than CF! James against a low block is borderline pointless! Nowhere to kick + run! Brilliant kind of player to have away from home or as an impact sub from the bench but starting at home we need more invention #MUFC,#MUFC
1576421731,you must be knocked out or to be english to get that foul #MUFC,#MUFC
1576421732,Fuck me if Souness even says it was a foul \ud83e\udd14 #MUFC,#MUFC
1576421734,It\u2019s a foul but De Gea will disappointed in himself #MUFC #MUNEVE,#MUFC
1576421736,"Besides running in circles, does anyone know what Lingard does on the pitch? #MUFC #MUNEVE",#MUFC
1576421739,"Tbh I'd get Young on,try match them in midfield and please Greenwood for Martial \ud83d\ude12 #MUFC",#MUFC
1576421740,\ud83e\udd14\ud83e\udd14\ud83e\udd14 No foul apparently #MUFC https://t.co/2qQSGYvmxS,#MUFC
1576421740,Lingard and shaw both terrible players who need binning. The sooner the better. #MUFC,#MUFC
1576421740,"Proper flaky United performance, this. Lose today and it tells us far more about this United team than the wins vs Spurs &amp; City did. #MUFC",#MUFC
1576421740,Never thought I\u2019d see the day Graeme Souness would defend Man Utd #BPL #MUFC,#MUFC
1576421742,Playing with a single midfielder in a 5-3-2!! Baines on for Digne and every single United player lacking the brain cells to get James more on the ball 1v1 with Baines!! Ole's gotta be fuming with this performance after 2 impressive wins!! Big 2nd half coming up! #MUFC #MUNEVE,#MUFC
1576421747,"VAR is a fucking joke, Calvert-Lewins arm blatently in De Gea\u2019s face, goes to VAR and is still given. Football is a fucking joke #ScrapVAR #MUFC",#MUFC
1576421748,"How is that normal contact? VAR inconsistency again.. all we seem to talk about before, during and after games! Scrap it. RIP the beautiful game. #supersunday #MANEVE #MUFC \u26bd\ufe0f",#MUFC
1576421749,What are the odds that I pick Lindel\u00f6f this week for my #FPL teamAnd Lindel\u00f6f scores an own goal? \ud83d\ude43\ud83d\ude2d#MUFC,#MUFC
1576421749,Why are you doing this to me \ud83e\udd26\u200d\u2642\ufe0f #MUFC,#MUFC
1576421751,"This is why I keep saying signing sancho &amp; h\u00e5land won't make the difference Vs 'small' teams, look at lingard he is not creative apart from pressurizing the opponents yet he is our best no10 at the moment, Shaw couldn't make important runs to support attacks. #MUFC #MUNEVE https://t.co/DIcjW8I1kK",#MUFC
1576421754,"We are very sloppy, passing in the final third is poor, we are getting space to run but we are not utising them. #MUFC",#MUFC
1576421755,Our full backs are pressed as soon as they get the ball.. Mct &amp; James are given no space.Shaw is shitThese are the games when midfielder who can drive &amp; dribble through the middle &amp; create is needed..(enter pogba ? \ud83e\udd14) #MUFC #MANEVE,#MUFC
1576421756,How that goal has been allowed is absolutely bizarre. Clear DDG should have done better but he\u2019s had a hand in his face 1 yard from the goal line. Incredible that everyone can see it but it\u2019s been allowed. #MUFC,#MUFC
1576421756,If that had been Pickford flapping at it like De Gea and a foul had been given I would be fuming. Never a foul \ud83e\udd37\u200d\u2642\ufe0f #MUFC,#MUFC
1576421758,"Take Lingard off bring Greenwood on, revert to a 4-2-2 Martial+ Greenwood up top and go for it. You\u2019re at home we need to hammer teams like this #MUFC",#MUFC
1576421760,Lindelof reacted like it was a grenade not a football. It's so weird these players become world class against top teams and plays like fools against smaller ones. It's the basic things. Passing was magnificent against City and see them now. Pathetic #MUFC #MUNEVE,#MUFC
1576421761,"Not only do we have shite players.We have shite players, with a shite attitude.Only want to play in the big games.#MUFC",#MUFC
1576421761,magical 2nd half ahead \u26bd\ufe0f\u26bd\ufe0f\u26bd\ufe0f @ManUtd #MUFC \ud83d\udd34,#MUFC
1576421761,Souness contradicting himself 5822298323 times in one sentence#MUFC #EFC #MUNEVE,#MUFC
1576421764,VAR is a disgrace. #MUFC https://t.co/Q1Wd4gXj0N,#MUFC
1576421765,@samuelluckhurstShaw really isn't good at defending. Most of his clearances end up with the opposition &amp; he ain't that good at attacking either... #Maguire ain't worth 80m #Lindelof has too many lapses in concentration.  #MUFC #MUNEVE,#MUFC
1576421767,"Graham Souness spot on regarding De He's. Arm in the face is a foul but De Gea has to be stronger and come out to that ball like he's just come home to find his neighbour nicking his newspaper, clean em all out of the way. #MUFC #MUNEVE",#MUFC
1576421769,"First Half Thoughts: - De Gea was fouled, but he must be stronger - Lindelof isn\u2019t at fault for the OG-Shaw was a cricket - Ole again has no pattern of play in the build up- We need a real number 10 #MUFC #MUNEVE",#MUFC
1576421773,"The #OleOut banners are coming out again? I thought you lot were gassed last week after City. \ud83e\udd23Playing on the break with big teams ain't rocket science, the man is a whole fraudster. #MUFC #PochFC \ud83e\udd37\ud83c\udffd\u200d\u2642\ufe0f",#MUFC
1576421773,"Can\u2019t believe people are calling for a foul on De Gea for the goal. Keepers usually get way too much protection, thankfully not today. He\u2019s got to be stronger there. #MUFC #MUNEVE",#MUFC
1576421773,"@UnitedStandMUFC Typical of how the season and the last few years have gone. We have no plan b, like Jose said we can punish teams that come at us but when the opposition sits in and asks you what you got? we stumble. Have to be more inventive and clever in the 2nd half #MUFC",#MUFC
1576421774,Bollocks! His arm is in his face! It's a foul! #MUFC,#MUFC
1576421774,Back to normality then? If you want a manager who can beat the top 6 but not the other 13 teams consistently that\u2019s on you. You\u2019d think they\u2019d be working on breaking low blocks all day everyday as we\u2019ve had the same problem for over a year #MUFC,#MUFC
1576421774,No counter attack no party I\u2019m afraid #MUFC,#MUFC
1576421775,We (#MUFC) are playing into Everton's hand by giving away free kicks and corners....that's exactly what they want. We just can't break a team that seats and tries a counter. #MUNEVE,#MUFC
1576421775,"Screw this United team. Fucking knew they'd bottle it today.Solskjaer has been in the job for a whole year and has still yet to find a way to break teams down when they sit back. It's embarrassing, small club standard.#MUFC",#MUFC
1576421776,I'm not even gonna say anything . #MUFC,#MUFC
1576421777,"Don't think we particularly deserve to be losing this one at half time, plenty of chances but classic story of being unable to break a defensive team down and not taking chances when we do.Not sure how we change this, maybe a switch to a flat 4-3-3? #MUFC",#MUFC
1576421779,That Top 4 Talk was Way to Easy people getting carried away #MUFC,#MUFC
1576421779,Don't deserve to be behind but we are. And it isn't cos it's a 'smaller' team that's parking the bus. Far from it. They're pressing high and we can't play through it. We've had chances to be ahead too. Bit more adventure and we got this. Come on reds \ud83c\uddfe\ud83c\uddea #MUFC https://t.co/3dwRYWbqxA,#MUFC
1576421780,In need of Second-half FC \ud83d\ude4f\ud83c\udffc#MUFC https://t.co/cB1vkGUB6J,#MUFC
1576421780,Fans have been buzzing all week. Showing mad support to these guys. They show up looking uninterested. Shaw looks like he\u2019s ready to go home. #MUFC,#MUFC
1576421789,We'll be Infront in the end. #MUFC #MUNEVE,#MUFC
1576421791,Graeme Souness on Sky saying that was definitely a foul but at the same time think De Gea should have done better. What? #MUFC,#MUFC
