timestamp,text,hashtags
1576422348,Those Jose adjustments not yet visible #COYS,#COYS
1576422348,"Five minutes without a heart attack would be nice at the moment please, spurs. #COYS",#COYS
1576422356,What the fuck is Tottenham playing ? #WOLTOT God,#WOLTOT
1576422357,@nel1011 Sorry again lol why did I think you were LFC \ud83e\udd37\ud83c\udffc\u200d\u2642\ufe0f #COYS \ud83d\ude09,#COYS
1576422364,49' | #WOL 0-1 #TOTGreat save from Gazzaniga as he gets down low to his right to palm a Jimenez effort wide of goal.#WOLTOT,#WOLTOT
1576422369,We all need to calm down! We knew it would be tough! It is tough but the Wolves keeper has had more to do! #WOLTOT #COYS,#WOLTOT
1576422374,#WOLTOT Free Live Streaming - NO ADSWolverhampton Wanderers vs Tottenham Hotspur-&gt; Live Stream: https://t.co/qY1QXEIkzz,#WOLTOT
1576422376,Bloody hell! Gazza keepin us in the game! #WOLTOT #COYS,#WOLTOT
1576422401,0-1 up and getting hammered. We need to show more aggression and keep Wolves off the ball #COYS,#COYS
1576422410,48\u2019| \ud83d\udfe0#WOL 0-1 #TOT\u26aa\ufe0fJimenez does brilliantly to skip past a few Spurs challenges but his shot from the outside of the box is matched by Gazzaniga!Wolves hav started brilliantly! #WOLTOT,#WOLTOT
1576422412,"We need to score again, as there\u2019s no way Wolves won\u2019t #WOLTOT",#WOLTOT
1576422418,Wouldn't be shocked if Wolves score 3 this half. Completely one sided match. #WOLTOT,#WOLTOT
1576422419,We just cannot get the ball#COYS #THFC #PL #WOLTOT,#COYS
1576422419,Try @RyanSessegnon at right back in the 2nd half? Poor Vertonghen doesn\u2019t have the legs for Traore. #COYS #THFC #SPURS,#COYS
1576422423,Foyth on for Aurier please #COYS,#COYS
1576422424,Wolves reduced to kicking the ball at Spurs arms just to fluke a penalty... #COYS #THFC,#COYS
1576422429,Oboi! Wolves running riot big time #WOLTOT,#WOLTOT
1576422441,"Watching the spurs game whilst making Sunday dinner , who said men can\u2019t multi task. \ud83d\ude02\ud83d\ude02\ud83d\ude02 #COYS https://t.co/rLUpzY4pQf",#COYS
1576422446,God we suck. Absolutely suck. How we win games is laughable. #WOLTOT,#WOLTOT
1576422452,"#THFC our back 4 look old, slow and sloppy #COYS",#COYS
1576422458,Do Spurs only have 9 on the pitch? Jesus... #WOLTOT,#WOLTOT
1576422459,you should be checking the handball by Jota earlier #COYS,#COYS
1576422461,Wolves v Tottenham Premier League LIVE STREAMLink.https://t.co/oXOTRakGS3#WOLTOT,#WOLTOT
1576422462,What are we doing???? #THFC #COYS,#COYS
1576422467,Full extension from Gazzaniga to keep Spurs on top \ud83d\udc40 #WOLTOT https://t.co/yCwq73yvjB,#WOLTOT
1576422471,Wolverhampton Wanderers vs Tottenham HotspurLive HD StreamMobile/Console1. https://t.co/NYx8n4A29l2. https://t.co/5SxrMrhrVyPC1. https://t.co/52CaEvjl6k2. https://t.co/VOqvCQUOlyHits Like &amp; Retweet #WOLTOT https://t.co/RPKp4IfQp5,#WOLTOT
1576422472,We are getting battered here. What is going on? #WOLTOT #spurs #thfc #coys,#WOLTOT
1576422475,FREE LIVE STREAM #PL 2HWolves vs Tottenham Live&gt;&gt; https://t.co/mhHkFSHfri#WWFC #THFC #WOLTOT++Manchester United vs EvertonLive&gt;&gt; https://t.co/P9eQdi4qWC#MUFC #EFC #MUNEVE++FREE LIVE STREAM #SPFLCeltic vs Hibernian&gt;&gt; https://t.co/NZaqEs7b8V#CELHIB #CelticFC https://t.co/JOsV38QHIm,#WWFC
1576422476,Are we outnumbered or outplayed in midfield right now? Maybe sub Lo Celso on for Lucas? #COYS,#COYS
1576422485,"Some Keystone Cops-style defending, back there.  .\ud83d\ude2c#COYS",#COYS
1576422502,Feel like we playing 11 on 9. #COYS #THFC,#COYS
1576422506,#WOLTOT: 49' Wolves pick up from where they left off with Doherty making a superb run down the right. He cuts an inviting ball back but Gazziniga does well to claim.@Wolves 0-1 @SpursOfficial#PremierLeague #PL #Spurs #THFC #Wolves #COYS,#WOLTOT
1576422507,@NBCSportsSoccer ummmm... didn't know it could get more awkward than when the humans put this damn sweater on me#THFC  #COYS  #MyPLMorning  @premierleague @SpursOfficial https://t.co/Mpexajz7er,#COYS
1576422508,TAKE FUCKING UNMOBILE DIER OFF...HE IS FUCKING CRAP!!!! #COYS #WOLTOT,#COYS
1576422515,This is a fun game to watch. @NBCSportsSoccer #WOLTOT,#WOLTOT
1576422516,Bright and early at Esters with my @CO_Spurs fam. We love the 7a kickoff but wish our defense would get it together \ud83e\udd0d #COYS #MyPLMorning #WOLTOT https://t.co/Bku1Yxl8vD,#COYS
1576422518,Did they have chat about the weather at HT? What the hell is this? #COYS #THFC #Spurs #WOLTOT,#COYS
1576422521,ARE DEFENSE IS SOO SHITEEEE #WOLTOT,#WOLTOT
1576422525,Going to be a nervy 40min more at this rate.  #COYS #WOLTOT,#COYS
1576422527,Live streaming #PremierLeague #MANEVE #WOLTOT https://t.co/fv9coSowmv,#WOLTOT
1576422528,They will score soon if don\u2019t liven up. They all over us here #COYS,#COYS
1576422532,Tottenham really misses a guy like Dembele today who would have cleaned up the horrendous midfield play #COYS #THFC,#COYS
1576422537,The second half has started just as stressfully as the first finished. It\u2019s all Wolves pretty much. #COYS #WOLTOT,#COYS
1576422537,Wolves are absolutely pummeling the Spurs' goal. Mourinho will no doubt be looking to upgrade the full-back positions in January which may be their only major weakness.Wolves deserve a goal#WOLTOT,#WOLTOT
1576422537,48\u2019| \ud83d\udfe0#WOL 0-1 #TOT\u26aa\ufe0fJimenez does brilliantly to skip past a few Spurs challenges but his shot from the outside of the box is matched by Gazzaniga!Wolves hav started with serious intent.#WOLTOT,#WOLTOT
1576422546,Good job spurss!! #COYS,#COYS
1576422554,We're looking like some right lumps #COYS,#COYS
1576422554,Did the lads have their Xmas do last night ? #COYS,#COYS
1576422554,Harry Kane loves going to ground. A gentle breeze sends him tumbling#WOLTOT,#WOLTOT
1576422569,"Be a miracle if we keep a clean sheet at the rate, can see Jan giving away a pen with Traor\u00e9 pace &amp; speed.Wolves showing us how football should be played !#COYS #THFC #WOLTOT",#COYS
1576422573,Why can't spurs just clear the ball \ud83d\ude21\ud83e\udd7a #COYS,#COYS
1576422574,How are we holding on...? #COYS https://t.co/rfvP9zNDXe,#COYS
1576422582,I think the composure in possession of Winks could be a smart substitution. #COYS,#COYS
1576422582,Stop looking for the penalty and play the damn ball #HarryKane#WOLTOT #coys,#WOLTOT
1576422584,They will score for sure if we continue to play like this #THFC #COYS #WOLTOT,#COYS
1576422590,How the fuck is that not a penalty for #Kane. They didn\u2019t even look at it. Christ. #WOLTOT #PL #COYS #THFC,#WOLTOT
1576422590,Almost!! Kane!! #COYS,#COYS
1576422592,Me watching the game:#WOLTOT #COYS https://t.co/hGsVIAjEA5,#WOLTOT
1576422593,Kane you\u2019re not Rashford the ref will never give you that #COYS,#COYS
1576422603,Kane goes down so easy in the box. Just take the shot. #WOLTOT,#WOLTOT
1576422612,"#WOLTOT Wima - Explore, Search, Chat and Meet Wima Users Around You. See details...https://t.co/GXAaHmwaw8 https://t.co/UMgvZGd23m",#WOLTOT
1576422612,Normally support @Wolves in matches I\u2019m neutral on (meaning anything not involving Spurs) but DAMN do they piss and moan about everything... #coys #thfc #WOLTOT,#WOLTOT
1576422613,"#WOLTOT Aboki Forex, Currency Converter/Calculator, Forex News and more. See details...https://t.co/hdGFBwI86I https://t.co/WXodLWhM9j",#WOLTOT
1576422616,These wolves fans whine about every call #WOLTOT,#WOLTOT
1576422620,I find the uniform combination of Spurs blue and Wolves yellow to be extremely pleasing. #COYS  #WOLTOT https://t.co/3IoRzLj0L3,#COYS
1576422621,The English Premier League is different. In most leagues Tottenham would have had 2 penalties over Harry Kane. #COYS,#COYS
1576422624,Why\u2019s kane not been booked for 2 dives? #wwfc #WOLTOT,#WOLTOT
1576422629,I hope Mou is seeing what Poch couldn't: Sanchez is a speedy bang average CB. He's been absolutely shocking today. Rather him replaced before Toby or Jan. #WOLTOT #COYS,#WOLTOT
1576422637,Call the lumberjack time for Dier to be felled\ud83c\udf33 #COYS,#COYS
1576422659,#WOLTOT is more interesting mehn,#WOLTOT
1576422663,"How I see it, Traore still can't beat Vertonghen #COYS #WOLTOT",#COYS
1576422663,"#WOLTOT Spurs too slow. Running, decision making, all slow. Wolves to take it 3-1",#WOLTOT
1576422670,All I'm saying is there should be at least 2 pens given one to each side #WOLTOT,#WOLTOT
1576422672,"#WOLTOT Son can\u2019t tackle, absolutely shite",#WOLTOT
1576422672,Ok having some possession #COYS,#COYS
1576422677,This game is just the continuation of the horror from the first half. Home team dominating the ball and poor control and passes from spurs #WOLTOT,#WOLTOT
1576422682,Flow #WOLTOT via @premierleague https://t.co/AXQRJOmMMC,#WOLTOT
1576422685,"Atwell wont even give yellow cards for fouls on counter attacks today, it's hard to see him giving a pen, even if Kane has had a good shout. #COYS #THFC",#COYS
1576422691,What a game so far! #pace #WOLTOT,#WOLTOT
1576422692,Wolves fans going to claim hand ball on a penalty kick at this rate. #COYS #THFC,#COYS
1576422702,Wolves should be sponsored by Duracell #WOLTOT #THFC,#WOLTOT
1576422704,Have we forgotten how to keep hold of the ball??? #painful #WOLTOT #COYS,#WOLTOT
1576422705,Mourinho trying to park the bus with aurier and sanchez #COYS https://t.co/L2Kz6m7HRZ,#COYS
1576422707,#WOLTOT lets go #son,#WOLTOT
1576422709,"I\u2019ve wanted to sign Adama Traore for years. We don\u2019t even have to play him, just don\u2019t want to play against him. Best player in the world for me. #COYS",#COYS
1576422711,#WOLTOT: 51' Wolves absolutely battering Spurs at the start of this second half. The visitors' clean sheet does not feel sustainable unless they change something.@Wolves 0-1 @SpursOfficial#PremierLeague #PL #Spurs #THFC #Wolves #COYS,#WOLTOT
1576422715,Harry Kane is a cheating twat.#WOLTOT,#WOLTOT
1576422718,Would be amazed if Wolves don't go on to win this. We've been so poor and the pressure will eventually tell. We need at least 1 more goal ASAP to have a chance#WOLTOT #THFC,#WOLTOT
1576422721,Opinion: Jose\u2019s Side vs Woves Is As Good As It Gets\u2026 For Now https://t.co/EVeIqv7McM #THFC #COYS #TTID https://t.co/QDU7gK9de3,#COYS
1576422723,"Atwell's having a mare, and left his cards at home. Two fouls stopping counter attacks not punished #WOLTOT",#WOLTOT
1576422723,Harry Kane should of had two yellows for diving #WOLTOT,#WOLTOT
1576422725,"First long ball I\u2019ve seen from Toby, need more of those #WOLTOT #coys",#WOLTOT
1576422725,Live footage of Harry Kane #WOLTOT https://t.co/tGdEbwU8n1,#WOLTOT
1576422728,Their targeting Dele now/ Chopping him to pieces and the ref is doing nothing. #COYS,#COYS
1576422736,@HamidTHFC @MicahKellner Wolves playing like we used to .. we are being outplayed and out pressed #COYS,#COYS
1576422744,Kane at it again #WOLTOT https://t.co/P9hLdYxeVG,#WOLTOT
1576422755,"Thankfully, Traor\u00e9 has an abysmal first touch. Else we would be behind. #COYS",#COYS
1576422760,"Harry Kane twice went down softly inside the penalty box, twice waved away by ref. He should have been yellow carded for diving. Does that all the time. #WOLTOT",#WOLTOT
1576422760,Be a miracle if we hold onto this lead #COYS #THFC,#COYS
1576422761,Every Spurs fan right now#COYS #THFC #PL #WOLTOT https://t.co/Ug2Dh6ivLf,#COYS
1576422770,Vertongen is barely keeping up pace =/ #COYS,#COYS
1576422778,#WOLTOT change that fucking midfield,#WOLTOT
1576422794,@EashN17 They've been Cardiac FC for a couple of seasons now.#THFC #COYS,#COYS
1576422795,Spurs need more possession. Wolves have 60-40 advantage and 8-1 edge in corners. #COYS #WOLTOT,#COYS
1576422799,Wolves are also losing to Spurs 1-0 atm. Huge #WOLTOT,#WOLTOT
1576422801,#COYS let\u2019s go fing that insurance goal 2-0 soon please,#COYS
1576422804,Shocked it\u2019s still 1-0. It\u2019s constantly been Wolves in our box #WOLTOT,#WOLTOT
1576422804,I don\u2019t think I\u2019m breaking any hot news here but goddamn do Wolves look good \ud83d\ude33\ud83d\ude33#COYS,#COYS
1576422813,FREE LIVE STREAM #SPFLCeltic vs Hibernian&gt;&gt; https://t.co/cbT8epCt6L#CELHIB #CelticFC++FREE LIVE STREAM #PLWolves vs Tottenham Live&gt;&gt; https://t.co/KU6lliniF1#WWFC #THFC #WOLTOT++Manchester United vs EvertonLive&gt;&gt; https://t.co/JiVcsprXQJ#MUFC #EFC #MUNEVE https://t.co/08x5tp9MoV,#WWFC
1576422814,FREE LIVE STREAM #PLWolves vs Tottenham Live&gt;&gt; https://t.co/0F51n3aJ6Q#WWFC #THFC #WOLTOT++Manchester United vs EvertonLive&gt;&gt; https://t.co/ykr588QRx3#MUFC #EFC #MUNEVE++FREE LIVE STREAM #SPFLCeltic vs Hibernian&gt;&gt; https://t.co/mdIHt8X59N#CELHIB #CelticFC https://t.co/MCF9e7tE5D,#WWFC
1576422821,Slim lead lads; best get scoring. #WOLTOT #COYS #EPL #BPL #PremierLeague,#WOLTOT
1576422823,"Seems like one of those days that you insist Copa Mundials are acceptable footwear in all weather conditions, even though this pitch definitely needs a metal stud #WOLTOT",#WOLTOT
1576422827,Some of this Spurs defending has been absolutely heroic today. #WOLTOT,#WOLTOT
1576422829,Remember the Uighurs . Money without morality is a curse. No winners with rise in oppression and division  #WOLTOT,#WOLTOT
1576422841,Tottenham *Park the bus* Hotspur #WOLTOT,#WOLTOT
1576422848,We desperately need another body in MF #COYS,#COYS
1576422854,We don\u2019t need a second I\u2019m moving on to getting a third #COYS,#COYS
1576422861,Play some decent football goes to Dier and he hoofs it. Someone please tell me how he\u2019s in this team over Skipp and Winks. It\u2019s so obvious he\u2019s not bloody good enough \ud83d\ude24\ud83d\ude24 #COYS #WOLTOT,#COYS
1576422863,More goals\u2019ll prevent WOL from stealing a pt late... #WOLTOT #COYS #EPL #BPL #PremierLeague,#WOLTOT
1576422869,The real Mourinho is back ! #WOLTOT,#WOLTOT
1576422878,There shd be a change somewhere for Spurs..... That left back position has been under serious threat all day #WOLTOT,#WOLTOT
1576422880,"Wow, Alli should\u2019ve had that. It lacked conviction. Something is off with him today. #COYS",#COYS
1576422884,I feel like there just isn\u2019t a conscious effort to string passes together. It looks like we are only trying to clear. Won\u2019t hold the whole game. #COYS #WOLTOT,#COYS
1576422887,This game would be perfect for Lamela. The intensity he'd bring to this party would be ideal ! #WOLTOT #THFC,#WOLTOT
1576422888,58' | #WOL 0-1 #TOTDele Alli goes close for @SpursOfficial as he collects a ball on the edge of the box before curling an effort just wide of the target.#WOLTOT,#WOLTOT
1576422895,Eric Dier #WOLTOT https://t.co/XZGgD7vHRa,#WOLTOT
1576422913,"If Dele Alli and Harry Kane were foreigners the media would blast them everyday, I have never seen 2 players to dive around like them. Having said that I don't know how wolves are not 5 up. Playing them lots off the park at times. Mourinho  is more lucky than brilliant #WOLTOT",#WOLTOT
1576422915,I forgot Alli was even on the pitch#WOLTOT,#WOLTOT
1576422917,Sooooo close to a brilliant finish from Dele #THFC #COYS,#COYS
1576422920,"From the edge of the area, Siri curls one into the top corner. #takeabow #COYS #SpursWomen #spurheron",#COYS
1576422921,"Not looking like being Son's day today \ud83d\ude2a, Lucas steps up to the plate \ud83d\udc4d\ud83c\udffb #COYS #THFC #WOLTOT",#COYS
1576422922,Jan doing his best Gandalf so far.  #COYS https://t.co/zu9V7Igi5A,#COYS
1576422922,Wolves just have us on lockdown #COYS,#COYS
1576422926,@SpursWomen @Siriworm Thought it was 2-0 to Spurs mens for a sec but well done women! #COYS,#COYS
1576422931,1-0 UP @ HT #COYS https://t.co/D4OpkNmZcn,#COYS
1576422942,Lucas Moura's slaloming run and rocket finish has Tottenham up at Molineux \u26f7\ufe0f#WOLTOT (via @NBCSportsSoccer)https://t.co/emFASrHWeh,#WOLTOT
1576422943,"If we score a second goal, it would be completely undeserved. So of course we will score a second goal. #COYS",#COYS
1576422946,Moura &amp; Alli both full of inspiration. #WOLTOT #COYS,#WOLTOT
1576422955,"It\u2019s not that our defence is too old(Ramos 33, Maldini playing till he was 41), it\u2019s pure lack of skill and passion #COYS",#COYS
1576422972,\u270d\ufe0f We\u2019ve got some great opportunities for football fans and aspiring writers take a look here and if you want to know more get in touch...\u2b07\ufe0f#WOLTOT https://t.co/8jVxscAP7M,#WOLTOT
1576422976,58\u2019| \ud83d\udfe0#WOL 0-1 #TOT\u26aa\ufe0fDele \ud83d\ude31Lucas\u2019 ball into the box eventually finds Dele on the edge of the box who almost curls a beauty into the far right corner but it is inches wide.#WOLTOT,#WOLTOT
1576422979,A positive is that we are breaking well and on the counter making good decisions and showing our quality. Another good chance for Alli there following good play from the goal scorer Lucas Moura. #COYS #WOLTOT,#COYS
1576422982,"Spurs' final 3rd passes need to be better, and they need to be better now! #WOLTOT",#WOLTOT
1576422983,It\u2019s just about time before Wolves score. #WOLTOT,#WOLTOT
1576422996,finally a card!!! #COYS,#COYS
1576422998,Wolves shdnt be having 60% ball possession against Spurs. No. #WOLTOT,#WOLTOT
1576423000,Spurs up 0:1 at the hour mark #WOLTOT,#WOLTOT
1576423007,Harry Kane running into the penalty area #WOLTOT https://t.co/jgUr9MX64i,#WOLTOT
1576423008,Well deserved yellow for Moutinho #THFC #COYS,#COYS
1576423008,Anyone got any Spurs streams?My has died (https://t.co/qtrW4kzrYP)#WOLTOT #COYS #THFC,#WOLTOT
1576423008,Dele's effort goes just wide. Both teams have had decent chances in this second half so far. Wolves still dominating the ball. #THFC #WOLTOT https://t.co/YvfOz8OHBZ,#WOLTOT
1576423010,"\ud83d\udd25 Longest Current Unbeaten Streaks (EFL):12 - WEST BROM &amp; WYCOMBE \u2b5011 - Leeds7 - Millwall, Blackpool, Swindon &amp; Scunthorpe\ud83c\udfc6 Unbeaten in 12 games, West Brom and Wycombe both top their League tables#WBA #WWFC #Chairboys #LUFC #Millwall #UTMP #STFC #UTI https://t.co/bAwLQtHGLc",#WWFC
1576423013,\u26bd\ufe0fWolves vs Tottenham is finishing up on UNIVERSO right now... BUT....\ud83d\udd34Arsenal vs Man City\ud83d\udd35 will be on Telemundo at 10:30am ET. Pep will be coaching his 200th game with MC. Check it out! #LigaPremierTD #PremierLeague #WOLTOT #ARSMCI https://t.co/cMLABYMqMN,#WOLTOT
1576423022,"Wolves have only won 3 times at home out of 8 attempts this season, against the teams ranked 15th, 17th and 20th #COYS #WOLTOT",#COYS
1576423023,Landed in sunny Barcelona to see we're losing \ud83d\ude2d channeling all my good energy into a second half comeback #WWFC,#WWFC
1576423041,Unlucky Dele.Really need to take one of these chances on the break.#COYS,#COYS
1576423056,"On the flanks, Vertonghen has been weaker than Aurier. Serge is performing considerably stronger against Jota than Jan is against Traore. #WOLTOT",#WOLTOT
1576423064,"I'd expect Eriksen at some point this match, right? #THFC #COYS",#COYS
1576423065,Verthogen looks exhausted #THFC #COYS,#COYS
1576423065,Moutinho getting booked for THAT is some bullshit. #wwfc #WOLTOT,#WOLTOT
1576423070,Spurs needs to score two more goals before the inevitable 2 goals we concede happen. #WOLTOT,#WOLTOT
1576423081,"If wolves score, they\u2019ll get a few \ud83d\ude2c\ud83d\ude44 #WOLTOT #coys #thfc",#WOLTOT
1576423123,Wolves fans sound like they\u2019re gonna riot. #WOLTOT #coys #wwfc,#WOLTOT
1576423124,...that\u2019s a really delayed call. Would rather take the foul on Dele. Closer to box. #WOLTOT,#WOLTOT
1576423124,Wolves are excellent but I cant watch much more of this... what have we had; 6% possession?.... seem to not care about having the ball as long as we have 9 men behind the ball roughly 6-12 yards infront of our goal! #COYS,#COYS
1576423126,Spurs starting to get free balls and put passes together in the midfield now. Am I a fool to hope? #COYS,#COYS
1576423127,"Vertonghen isn't the player he used to be anymore, laboured moves these days and has lost his legs. #WOLTOT",#WOLTOT
1576423133,Who the ref ... Steve Bull  ? #COYS https://t.co/7CfqY9UY57,#COYS
1576423138,"Spurs are so wasteful,and we clearly know we cant hold on With pressure #WOLTOT",#WOLTOT
1576423151,I'd love nothing more than harry to pop one in now....#WOLTOT,#WOLTOT
1576423159,That didn\u2019t get a yellow?!?!??! #THFC #COYS,#COYS
1576423164,Sonny isn\u2019t perfect.  But he\u2019s close. \ud83d\ude09 #COYS,#COYS
1576423168,Son taking a fk??? #COYS,#COYS
1576423175,"The one touch football and high pressure from Wolves is killing us ! Come on Spurs, we are being out played #COYS",#COYS
1576423176,Sonny went for goal on that lol #COYS,#COYS
1576423181,"If wolves doesn\u2019t score, then football is unfair Well, it never has #WOLTOT",#WOLTOT
1576423184,Keep it up! Lets get these 3 points. #THFC #COYS,#COYS
1576423186,Son your a fool for trying that shot from the free kick #WOLTOT,#WOLTOT
1576423192,"I\u2019ve that from Dele - so cheeky, the audacity! #COYS",#COYS
1576423195,Wolves play really good expansive football. Fun to watch. #WOLTOT,#WOLTOT
1576423207,#MANEVE #WOLTOT #ARSMCI #downstairsderby come on down... https://t.co/RVVAnKMlKw,#WOLTOT
1576423214,#WOLTOT how they can moan about these decisions is beyond me...worse than Stoke City fans,#WOLTOT
1576423216,"The longer it stays 0-1, the more I think we'll score next. #COYS #THFC",#COYS
1576423229,"Son's been our brightest player, but the referee constantly allowing Wolves to foul him with only one yellow shown. #COYS #THFC",#COYS
1576423235,"Why can\u2019t we string 3 passes together, boys??? #COYS",#COYS
1576423237,"Dele and Son should move more within the half spaces, that will bring them closer to the 18 more and allow Moura and Sissoko to be more adventurous on the wide positions while they keep the back 4 intact and Dier in front of the defence #WOLTOT",#WOLTOT
1576423247,"Finding it difficult to watch the match Live, click on my pinned tweet to watch Live Now2ND HALF Wolves 0 vs Tottenham 1\ud83d\udd25 \ud83d\udd25\ud83d\udd25 \ud83d\udd25 #WOLTOT #COYS #PL #PremierLeague",#WOLTOT
1576423253,"Get son off , having a shit day, done nothing. Give Sess a go #COYS",#COYS
1576423253,Wolves dirtiest team in the league?#WOLTOT #Wolves #TottenhamHotspur,#WOLTOT
1576423254,Fell asleep during #WOLTOT https://t.co/warkDa3RB3,#WOLTOT
1576423260,"Both teams now with 1-0 leads, 2 clean sheets please\ud83d\udc4d\ud83d\udc4a\ud83d\udc4a #COYS #SpurHerOn #TogetherTHFC",#COYS
1576423261,I still don't see a reason for that yellow card on Sanchez #COYS #WOLTOT,#COYS
1576423276,Sess on for Son would be nice #WOLTOT #coys #thfc,#WOLTOT
1576423278,And you get a yellow card and you get a yellow card  #WOLTOT,#WOLTOT
1576423285,Finally the referee booking Wolves for their cynical fouls. #COYS #THFC,#COYS
1576423293,Ref in trouble of losing control of this game @BBCLondonSport #COYS,#COYS
1576423298,\ud83d\udd36 #WOLTOT (65')Jonny Castro (#WOL)#FFELiveCards #FPL,#WOLTOT
1576423299,Can\u2019t remember the last time I\u2019ve seen Dier play as well as he has today #WOLTOT,#WOLTOT
1576423309,Wolves vs Tottenham HotspurWolves vs Tottenham Live StreamTottenham StreamClick HERE \ud83d\udd34https://t.co/AIDaeU0SVv\ud83d\udd34Click HERE \ud83d\udd34https://t.co/AIDaeU0SVv\ud83d\udd34Click HERE \ud83d\udd34https://t.co/AIDaeU0SVv\ud83d\udd34Click HERE \ud83d\udd34https://t.co/AIDaeU0SVv\ud83d\udd34#THFC #Spurs #COYS #Tottenham #WOLTOT https://t.co/M6ECtSakNe,#COYS
1576423313,"Silly foul from Sanchez there, now walking on a bit of a tightrope for the remainder of this game. #COYS",#COYS
1576423322,You get a yellow card. You get a yellow card. And you get a yellow card. #WOLTOT,#WOLTOT
1576423327,Soooo fancy @GuinnessUS @GuinnessIreland @SpursOfficial @PHLSpurs  #COYS https://t.co/OtIuirp3qS,#COYS
1576423335,#WOLTOT: 60' Stats Till Now!@Wolves 0-1 @SpursOfficial#PremierLeague #PL #Spurs #THFC #Wolves #COYS https://t.co/HlCg07ysv5,#WOLTOT
1576423338,Just run at 'em Lucas... get 'em sent off... #COYS #THFC,#COYS
1576423344,Foyth on for Dier to protect defence? #COYS,#COYS
1576423355,"63\u2019| \ud83d\udfe0#WOL 0-1 #TOT\u26aa\ufe0fThe temperature is really rising here at the Molineux, the Wolves fans letting their frustrations known to the referee and Spurs players.\ud83c\udfb6 \u201c You don\u2019t know what you\u2019re doing.\u201d \ud83c\udfb6#WOLTOT",#WOLTOT
1576423356,You get a yellow card! You get a yellow card! You get a yellow card! EVERYONE GETS A YELLOW!!!! #WolvsTot #COYS https://t.co/Jeumauc5W5,#COYS
1576423360,Has Jan coloured his hair? #COYS,#COYS
1576423373,Going to be a grimy last half hour #THFC #COYS,#COYS
1576423373,Ref has found his cards  #COYS,#COYS
1576423374,Wolves players just taking down anyone that that runs past them \ud83d\ude02 anti-football at its most cynical. #thfc #COYS,#COYS
1576423375,Our passing has been horrible today. #WOLTOT #COYS #THFC,#WOLTOT
1576423378,"Next 10 minutes will decide this game... With Tottenham pressing and looking quicker to get jumping on the counter, I feel they will hold the bag and get those points. #WOLTOT #COYS #MyPLMorning",#WOLTOT
1576423381,Video: Moura\u2019s powerful strike puts Spurs 1-0 up at Wolves https://t.co/pllEm29v0A #THFC #COYS #TTID https://t.co/g8Wp2KIUpQ,#COYS
1576423390,Sigh. #COYS,#COYS
1576423391,WHAT A GOAL TRAORE #WOLTOT,#WOLTOT
1576423395,Holy shit Traore #WOLTOT,#WOLTOT
1576423398,It was coming. 1s #WOLTOT,#WOLTOT
1576423400,Wow. Traore thunderbolt. Jimenez assist. Spurs CS kaput. \ud83d\ude33 #FPL #WOLTOT,#WOLTOT
1576423401,Possession: Wolves 61% Spurs 39%Corners: Wolves 9 Spurs 1#WOLTOT #THFC,#WOLTOT
1576423402,"Get in, Wolves. You deserved it. Sigh. #COYS",#COYS
1576423404,This damn game #WOLTOT,#WOLTOT
1576423406,Come on boys. Hang in there. Weather the storm.#COYS,#COYS
1576423408,Wow. That\u2019s how you do that. #WOLTOT,#WOLTOT
1576423408,COME ON !!! #wwfc #WOLTOT,#WOLTOT
1576423408,GOOOOOOAAAAAALLLL ADAMA TRAORE WOLVES 1 TOTTENHAM 1 #WOLTOT,#WOLTOT
1576423410,Been coming.... \ud83d\ude44#COYS,#COYS
1576423411,Welp #COYS https://t.co/0qGkNXHzLb,#COYS
1576423412,Good Goal #WOLTOT,#WOLTOT
